{
  "meta": {
    "name": "Startup + Mixed Behaviors",
    "description": "Classic startup with boom-or-bust trajectory and diverse participant behaviors. Tests how different strategies perform in high-uncertainty environments.",
    "version": "1.0"
  },
  "simulation": {
    "runs": 50,
    "duration_months": 36,
    "seed": null,
    "parallel_batches": 5
  },
  "business": {
    "archetype": "startup",
    "base_mrr": 300,
    "params": {
      "runway_months": 15,
      "breakthrough_prob": 0.08,
      "hockey_stick_multiplier": 5,
      "post_breakthrough_growth": 0.12,
      "building_revenue_range": [
        0,
        400
      ]
    }
  },
  "tokenomics": {
    "alpha": 0.2,
    "k": 0.01,
    "treasury": 100000,
    "s_min": 1000
  },
  "participants": [
    {
      "id": "true_believer",
      "name": "True Believer",
      "behavior": "diamond_hands",
      "grant": 15000,
      "referral_share": 0.15,
      "start_month": 1,
      "params": {
        "labor_intensity": 0.25
      }
    },
    {
      "id": "angel_referrer",
      "name": "Angel Referrer",
      "behavior": "rational",
      "grant": 8000,
      "referral_share": 0.3,
      "start_month": 1,
      "params": {
        "discount_rate": 0.05,
        "forecast_horizon": 12,
        "confidence": 0.7
      }
    },
    {
      "id": "skeptical_tester",
      "name": "Skeptical Tester",
      "behavior": "skeptic",
      "grant": 3000,
      "referral_share": 0.05,
      "start_month": 2,
      "params": {
        "patience": 8,
        "validation_threshold": 0.15
      }
    },
    {
      "id": "life_event_lisa",
      "name": "Life Event Lisa",
      "behavior": "life_event",
      "grant": 5000,
      "referral_share": 0.1,
      "start_month": 1,
      "params": {
        "trigger_month": 24
      }
    },
    {
      "id": "momentum_trader",
      "name": "Momentum Trader",
      "behavior": "trend_follower",
      "grant": 4000,
      "referral_share": 0.08,
      "start_month": 3,
      "params": {
        "lookback_window": 4,
        "panic_threshold": -0.25,
        "fomo_threshold": 0.3
      }
    }
  ],
  "entry_pool": {
    "treasury": 25000,
    "templates": [
      {
        "id": "word_of_mouth_pool",
        "name": "WoM Entrant",
        "behavior": "trend_follower",
        "grant": 2000,
        "referral_share": 0.06,
        "maxSpawns": 5,
        "entry_conditions": {
          "type": "word_of_mouth",
          "params": {
            "revenue_threshold": 3000,
            "probability_per_month": 0.2
          }
        },
        "params": {
          "lookback_window": 3,
          "panic_threshold": -0.2
        }
      },
      {
        "id": "price_signal_pool",
        "name": "Price Chaser",
        "behavior": "speculator",
        "grant": 1500,
        "referral_share": 0.04,
        "maxSpawns": 3,
        "entry_conditions": {
          "type": "price_signal",
          "params": {
            "price_threshold": 1.5,
            "probability": 0.25
          }
        },
        "params": {
          "timing_skill": 0.4,
          "trade_frequency": 0.15
        }
      }
    ]
  }
}